<?xml version="1.0"?>
<!--
/**
 * Copyright Â© 2016 Rocket Web Inc. All rights reserved.
 */
-->
<config xmlns:xsi="http://www.w3.org/2001/XMLSchema-instance" 
        xsi:noNamespaceSchemaLocation="urn:magento:module:RocketWeb_ShoppingFeeds:etc/shoppingfeeds.xsd">
    <feed name="generic" translate="label,description" 
          taxonomyProvider="RocketWeb\ShoppingFeeds\Model\Taxonomy\Type\Generic">
        <label>Generic</label>
        <description>Generic feed type.</description>

        <directives>
            <directive name="directive_static_value">
                <label>Static Value</label>
                <renderer type="RocketWeb\ShoppingFeeds\Block\Adminhtml\Feed\Edit\Form\Options\Renderer\StaticValue" />
                <mappers>
                    <mapper type="RocketWeb\ShoppingFeeds\Model\Product\Mapper\Generic\Simple\StaticValue" />
                </mappers>
            </directive>
            <directive name="directive_id">
                <label>Product Id</label>
                <renderer type="RocketWeb\ShoppingFeeds\Block\Adminhtml\Feed\Edit\Form\Options\Renderer\ProductId" />
                <mappers>
                    <mapper type="RocketWeb\ShoppingFeeds\Model\Product\Mapper\Generic\Simple\Id" />
                </mappers>
                <param>0</param>
            </directive>
            <directive name="directive_url">
                <label>Product URL</label>
                <renderer type="RocketWeb\ShoppingFeeds\Block\Adminhtml\Feed\Edit\Form\Options\Renderer\ProductUrl" />
                <mappers>
                    <mapper type="RocketWeb\ShoppingFeeds\Model\Product\Mapper\Generic\Simple\Url" />
                    <mapper for="configurable_child grouped_child bundle_child"
                            type="RocketWeb\ShoppingFeeds\Model\Product\Mapper\Generic\Configurable\Associated\Url" />
                </mappers>
                <param><![CDATA[]]></param>
            </directive>
            <directive name="directive_price">
                <label>Price</label>
                <renderer type="RocketWeb\ShoppingFeeds\Block\Adminhtml\Feed\Edit\Form\Options\Renderer\ProductPrice" />
                <mappers filter="true">
                    <mapper for="default" type="RocketWeb\ShoppingFeeds\Model\Product\Mapper\Generic\Simple\Price" />
                    <mapper for="configurable"
                            type="RocketWeb\ShoppingFeeds\Model\Product\Mapper\Generic\Configurable\Price" />
                    <mapper for="grouped"
                            type="RocketWeb\ShoppingFeeds\Model\Product\Mapper\Generic\Grouped\Price" />

                </mappers>
                <formatters>
                    <formatter type="RocketWeb\ShoppingFeeds\Model\Product\Formatter\Price\Currency" />
                </formatters>
                <param>1</param>
            </directive>
            <directive name="directive_image_link">
                <label>Product Image URL</label>
                <renderer type="RocketWeb\ShoppingFeeds\Block\Adminhtml\Feed\Edit\Form\Options\Renderer\ProductImage" />
                <mappers>
                    <mapper type="RocketWeb\ShoppingFeeds\Model\Product\Mapper\Generic\Simple\ImageLink" />
                </mappers>
            </directive>
            <directive name="directive_additional_image_link">
                <label>Product Additional Images URLs</label>
                <renderer type="RocketWeb\ShoppingFeeds\Block\Adminhtml\Feed\Edit\Form\Options\Renderer\ProductImageAdditional" />
                <mappers>
                    <mapper type="RocketWeb\ShoppingFeeds\Model\Product\Mapper\Generic\Simple\AdditionalImageLink" />
                </mappers>
                <param>image</param>
            </directive>
            <directive name="directive_category_image_link">
                <label>Product Category Image URL</label>
                <renderer type="RocketWeb\ShoppingFeeds\Block\Adminhtml\Feed\Edit\Form\Options\Renderer\HelpMessage" />
                <param>First category found with an image is been used.</param>
                <mappers>
                    <mapper type="RocketWeb\ShoppingFeeds\Model\Product\Mapper\Generic\Simple\CategoryImageLink" />
                </mappers>
            </directive>
            <directive name="directive_sale_price">
                <label>Sale Price</label>
                <renderer type="RocketWeb\ShoppingFeeds\Block\Adminhtml\Feed\Edit\Form\Options\Renderer\ProductPrice" />
                <mappers filter="true">
                    <mapper type="RocketWeb\ShoppingFeeds\Model\Product\Mapper\Generic\Simple\SalePrice" />
                    <mapper for="configurable grouped"
                            type="RocketWeb\ShoppingFeeds\Model\Product\Mapper\Generic\Configurable\SalePrice" />
                </mappers>
                <formatters>
                    <formatter type="RocketWeb\ShoppingFeeds\Model\Product\Formatter\Price\Currency"/>
                </formatters>
                <param>1</param>
            </directive>
            <directive name="directive_sale_price_effective_date">
                <label>Sale Price Date Range</label>
                <renderer type="RocketWeb\ShoppingFeeds\Block\Adminhtml\Feed\Edit\Form\Options\Renderer\HelpMessage" />
                <mappers>
                    <mapper type="RocketWeb\ShoppingFeeds\Model\Product\Mapper\Generic\Simple\SalePriceEffectiveDate" />
                    <mapper for="configurable grouped bundle"
                            type="RocketWeb\ShoppingFeeds\Model\Product\Mapper\Generic\Configurable\SalePriceEffectiveDate" />
                </mappers>
                <param>Computes the start and end dates of special price. If end date is not specified, defaults to one year.</param>
            </directive>
            <directive name="directive_availability">
                <label>Availability</label>
                <renderer type="RocketWeb\ShoppingFeeds\Block\Adminhtml\Feed\Edit\Form\Options\Renderer\HelpMessage" />
                <mappers filter="true">
                    <mapper type="RocketWeb\ShoppingFeeds\Model\Product\Mapper\Generic\Simple\Availability" />
                    <mapper for="configurable bundle"
                            type="RocketWeb\ShoppingFeeds\Model\Product\Mapper\Generic\Configurable\Availability" />
                    <mapper for="grouped"
                            type="RocketWeb\ShoppingFeeds\Model\Product\Mapper\Generic\Grouped\Availability" />
                    <mapper for="configurable_child grouped_child bundle_child"
                            type="RocketWeb\ShoppingFeeds\Model\Product\Mapper\Generic\Configurable\Associated\Availability" />
                </mappers>
                <param><![CDATA[Computes the product availability: in stock / out of stock. See additional setting <a href="#" data-tab-id="#feed_tabs_general">Use default Stock Statuses</a>]]></param>
            </directive>
            <directive name="directive_quantity">
                <label>Inventory Count</label>
                <renderer type="RocketWeb\ShoppingFeeds\Block\Adminhtml\Feed\Edit\Form\Options\Renderer\ProductQuantity" />
                <mappers>
                    <mapper type="RocketWeb\ShoppingFeeds\Model\Product\Mapper\Generic\Simple\Quantity" />
                    <mapper for="configurable grouped bundle"
                            type="RocketWeb\ShoppingFeeds\Model\Product\Mapper\Generic\Configurable\Quantity" />
                </mappers>
                <param>0</param>
            </directive>
            <directive name="directive_expiration_date">
                <label>Product Expiration in Feed</label>
                <renderer type="RocketWeb\ShoppingFeeds\Block\Adminhtml\Feed\Edit\Form\Options\Renderer\Expiration" />
                <mappers>
                    <mapper type="RocketWeb\ShoppingFeeds\Model\Product\Mapper\Generic\Simple\ExpirationDate" />
                </mappers>
                <param>7</param>
            </directive>
            <directive name="directive_variant_attributes" allow_output_limit="true">
                <label>Variant Attributes</label>
                <renderer type="RocketWeb\ShoppingFeeds\Block\Adminhtml\Feed\Edit\Form\Options\Renderer\VariantAttributes" />
                <mappers>
                    <mapper type="RocketWeb\ShoppingFeeds\Model\Product\Mapper\Generic\Simple\VariantAttributes" />
                    <mapper for="configurable grouped bundle"
                            type="RocketWeb\ShoppingFeeds\Model\Product\Mapper\Generic\Configurable\VariantAttributes" />
                </mappers>
            </directive>
            <directive name="directive_product_review_average">
                <label>Product Review Average</label>
                <mappers>
                    <mapper type="RocketWeb\ShoppingFeeds\Model\Product\Mapper\Generic\Simple\ProductReviewAverage" />
                </mappers>
            </directive>
            <directive name="directive_product_review_count">
                <label>Product Review Count</label>
                <mappers>
                    <mapper type="RocketWeb\ShoppingFeeds\Model\Product\Mapper\Generic\Simple\ProductReviewCount" />
                </mappers>
            </directive>
            <directive name="directive_concatenate" allow_output_limit="true">
                <label>Concatenate Attributes</label>
                <renderer type="RocketWeb\ShoppingFeeds\Block\Adminhtml\Feed\Edit\Form\Options\Renderer\Concatenate" />
                <mappers>
                    <mapper type="RocketWeb\ShoppingFeeds\Model\Product\Mapper\Generic\Simple\Concatenate" />
                    <mapper for="configurable_child"
                            type="RocketWeb\ShoppingFeeds\Model\Product\Mapper\Generic\Configurable\Associated\Concatenate" />
                    <mapper for="grouped_child"